speech_id,line_id,sentence_id,sentence_text
S030,109,0,"And these 32 days out from the election, it’s important that we remind people how we got here."
S030,109,1,Donald Trump handpicked three members of the United States Supreme Court with the intention that they would overturn Roe v.
S030,109,2,"Wade, and they did."
S030,109,3,"And now more than one in three women in America lives in a state with a Trump abortion ban, many with no exceptions even for rape and incest, which is immoral."
S030,110,0,"And when Congress passes a bill to restore reproductive freedom, as President of the United States, I will proudly sign it into law."
S030,110,1,Proudly.
S030,111,0,And here’s what I want to say.
S030,111,1,"Look, and that’s not our only battle."
S030,111,2,"Across our nation, we are witnessing a full-on assault on other hard-fought, hard-won freedoms and rights, like the freedom to vote; the freedom to be safe from gun violence; the freedom to join a union; the freedom to love who you love openly and with pride; and the freedom to breathe clean air and drink clean water."
S030,112,0,"Flint, you know all too well, Flint, that clean water should be a right for everyone, not just for the people who can afford it."
S030,112,1,"And as president, I will continue to work with communities like Flint to ensure you not only have clean water but the opportunity to recover economically and thrive."
S030,113,0,"So, Michigan, it all comes down to this."
S030,113,1,"We are all here together because we know what is at stake, and we love our country."
S030,113,2,We love our country.
S030,113,3,We love our country.
S030,114,0,"So, Election Day is in 32 days."
S030,114,1,And already nearly 2 million ballots are in the hands of Michigan voters alone.
S030,115,0,"So, if you have received your ballot, please do not wait."
S030,115,1,Fill it out and return it today.
S030,115,2,"Early voting starts statewide on October 26th, and now is the time to make your plan to vote, because, folks, the election is here."
S030,115,3,The election is here.
S030,115,4,"And we need to energize, organize, and mobilize."
S030,115,5,"And remember: Your vote is your voice, and your voice is your power."
S030,115,6,"So, Flint, today I ask: Are you ready to make your voices heard?"
S030,116,0,Do we believe in freedom?
S030,117,0,God bless you.
S030,117,1,And God bless the United States of America.
