speech_id,line_id,sentence_id,sentence_text
S033,34,6,"And we’ve got to say that you cannot be entrusted with standing behind the seal of the President of the United States of America engaging in that hateful rhetoric that as usual is designed to divide us as a country, is designed to have people pointing fingers at each other."
S033,35,0,It’s designed to do that.
S033,35,1,"And I think most people in our country, regardless of their race, are starting to see through this nonsense and to say, you know what?"
S033,35,2,Let’s turn the page on this.
S033,35,3,This is exhausting and it’s harmful and it’s hateful and grounded in some age-old stuff that we should not have the tolerance for.
S033,35,4,So let’s turn the page and chart a new way forward and say you can’t have that microphone again.
S033,36,0,Which is why I also have been very adamant for years.
S033,36,1,"In fact, I myself protested at a gun show probably 10, 15 years ago about the gun show loophole and why we need to close that."
S033,36,2,"Because what ends up happening is that gun shows at flea markets, gun dealers are not under existing law in the past required to register their sales."
S033,36,3,"And so you are exactly right that a lot of homicides, for example, a good number of them, I don’t have the statistic in front of my mind, are committed with illegally purchased guns."
S033,36,4,"And that’s why we need to address each entry point in the issue, including universal background checks, closing the gun show loophole,"
S033,37,0,"And we must take it seriously, in every way, understanding it’s not just about a soundbite."
S033,37,1,"It’s about a comprehensive approach that deals with the tragedy of, to your point, everyday gun violence in America."
S033,37,2,It’s real.
S033,37,3,It has had a profound impact in terms of trauma that for the most part has gone undiagnosed and untreated.
S033,37,4,"The trauma that exists in communities around the violence of losing their children, losing a brother, losing a father, an uncle."
S033,37,5,All of that must be addressed and we have to have a holistic response to it.
S033,38,0,"It’s about understanding what we need to do to, again, understand that, to your point, we have to have a holistic response to this issue and prioritize it instead of reacting to the tragedy that, sadly, they are too predictable."
S033,38,1,"Let’s all agree, enough of that."
S033,38,2,There are very few solutions that we haven’t thought of.
S033,38,3,We need to put the resources into them.
S033,39,0,"Laws that make no exception, even for rape or incest, which means that you’re telling a survivor of a crime of a violation to their body, that they have no right to make a decision about what happens to their body next, which is immoral."
S033,39,1,"An approach that doesn’t take into account that most people, I think agree, you don’t have to abandon your faith or deeply held beliefs to agree, the government should not be telling her what to do with her body."
S033,39,2,"If she chooses, she will talk with her pastor, her priest, her rabbi, her imam, but it should not be the government or Donald Trump telling her what to do about her own body and her life."
S033,39,3,"So, that’s where I stand."
S033,39,4,We need to put back in place the protection of Roe v.
S033,39,5,Wade and put that into law.
