speech_id,line_id,sentence_id,sentence_text,valence,arousal,dominance
S007,27,3,We are all in this together.,0.772,0.316,0.6060000000000001
S007,27,4,"And you all know from my entire career, I’ve only had one client, the people, the people.",0.6605,0.43325,0.573625
S007,28,0,"From being a young courtroom prosecutor in Oakland, I stood up for women and children against predators.",0.5175,0.5038333333333332,0.6596666666666667
S007,28,1,"As Attorney General of California, I took on the big banks and delivered $20 billion for middle-class families who faced foreclosure.",0.6447272727272727,0.43890909090909086,0.6092727272727273
S007,28,2,"I stood up for veterans and students being scammed by for-profit colleges, for workers who are being cheated out of their wages.",0.6124,0.4074000000000001,0.5917000000000001
S007,28,3,"And I pledge to you as president, I will fight for all Americans and together we will build a brighter future for our nation.",0.7368,0.5519000000000001,0.792
S007,28,4,We will build a future that includes thinking about our economy in a way that it is about lifting everyone up.,0.6936666666666667,0.4246666666666667,0.6694444444444444
S007,28,5,"We will build what I call an opportunity economy so that every American has an opportunity to own a home, to build wealth, to start a business.",0.7610833333333332,0.5288333333333333,0.7235
S007,29,0,"And let me tell you, I love our small businesses, of which I’ve met so many right here in Vegas.",0.6725714285714286,0.4111428571428571,0.5145714285714286
S007,29,1,"Growing up, our mother worked very long hours.",0.7314,0.4473999999999999,0.6218
S007,29,2,And so my sister Maya and I would go over two doors down to Ms.,0.5326666666666667,0.316,0.4203333333333334
S007,29,3,Shelton’s house.,0.587,0.135,0.533
S007,29,4,We called her our second mother.,0.6716666666666667,0.415,0.511
S007,29,5,And Ms.,,,
S007,29,6,Shelton was a small business owner.,0.669,0.36574999999999996,0.58725
S007,29,7,"So I know since I was a young child who our small businesses are, who our small business owners are.",0.6923,0.35379999999999995,0.5449
S007,29,8,Small businesses are the backbone of America’s economy.,0.6042,0.38239999999999996,0.564
S007,29,9,I know that.,0.765,0.361,0.704
S007,29,10,I know that.,0.765,0.361,0.704
S007,29,11,And Latina small business owners are the fastest growing segment of our economy.,0.6631428571428571,0.4002857142857143,0.6164285714285714
S007,30,0,"So my plan is about tapping into that ambition, those aspirations, those dreams, those incredible ideas, that strong work ethic that people have.",0.7108461538461538,0.5243846153846154,0.6643846153846155
S007,30,1,Also understanding not everybody gets handed $4 million on a silver platter and files for bankruptcy six times.,0.5773,0.4,0.48179999999999995
S007,31,0,"So my plan is about saying we’ve got to help entrepreneurs, startups out.",0.6974999999999999,0.4765,0.636
S007,31,1,"And I will give a $50,000 tax deduction to help entrepreneurs start their small businesses.",0.6242222222222221,0.45288888888888884,0.5711111111111111
S007,31,2,"Because right now that tax deduction is $5,000.",0.527,0.38375,0.58125
S007,31,3,Can’t nobody start a small business in 2024.,0.644,0.391,0.4794999999999999
S007,31,4,So we are going to make it something where it is doable to lift folks up.,0.6658571428571429,0.3851428571428571,0.5421428571428571
S007,31,5,We also need to build more housing in America.,0.6856666666666668,0.47466666666666674,0.5323333333333333
S007,32,0,My mother saved up for years till I was a teenager when she was able to buy our first home.,0.7273636363636363,0.4196363636363636,0.6021818181818183
S007,32,1,And right now a serious housing shortage is part of what is driving up cost.,0.567,0.3814444444444444,0.5264444444444444
S007,32,2,"So we will cut the red tape and work with the private sector to build 3 million new homes and provide first-time home buyers with $25,000 down payment assistance so you can just get your foot in the door.",0.6498636363636364,0.4209545454545454,0.5676818181818182
S007,32,3,You’ll do the rest.,0.7885,0.35750000000000004,0.41800000000000004
S007,33,0,"And we must lower the cost of living because while our economy is doing well by many measures, prices for everyday things like groceries are still too high.",0.5966,0.39239999999999997,0.4998000000000001
S007,33,1,You know it and I know it.,0.765,0.361,0.704
S007,33,2,"So I have a plan that includes lowering costs on everything from healthcare to groceries, including I will take on the corporate",0.6473636363636364,0.4266363636363636,0.5541818181818182
S007,34,0,"And in two days, I know we will cheer on Coach Walz when he debates JD Vance.",0.6687142857142857,0.5051428571428571,0.6421428571428571
S007,34,1,Yeah.,,,
S007,35,0,"And so as president, part of how I’m going to push this forward is I will get rid of unnecessary degree requirements for federal jobs, understanding that having a college degree is not the only measure of the skills and experience of a worker.",0.6407826086956521,0.44478260869565217,0.6314347826086957
S007,35,1,"And when we do that with the federal workforce, I’m coming to ask the private sector to challenge you to do the same.",0.5972500000000001,0.4932500000000001,0.6020000000000001
S007,35,2,So all of this is the same.,0.67,0.24,0.554
S007,35,3,I will always put the middle class and working families first.,0.6664285714285715,0.3921428571428572,0.5820000000000001
S007,35,4,"I come from the middle class, and I will never forget where I come from.",0.5303333333333333,0.29983333333333334,0.48033333333333345
S007,35,5,Now Donald Trump has a different plan.,0.66375,0.50975,0.67425
S007,35,6,"Just Google Project 2025, which I have to say I still can’t believe they put that thing in writing.",0.644875,0.37324999999999997,0.559875
S007,35,7,"They printed it up, they bound it, they handed it out.",0.49333333333333335,0.45500000000000007,0.4086666666666667
S007,36,0,Just Google it.,,,
S007,36,1,"It is a detailed and dangerous blueprint for what he would do if he were elected again, as president.",0.5511111111111112,0.4493333333333333,0.5844444444444444
S007,36,2,"Donald Trump will give billionaires and corporations massive cuts again, cut Social security and Medicare, and impose what I call a Trump sales tax, which would be a 20% tax on everyday basic necessities, which economists have measured would cost the average family nearly 4,000 more dollars a year in everyday expenses.",0.5990645161290322,0.46235483870967736,0.5859677419354838
S007,36,3,"And on top of all this, Donald Trump intends to end the Affordable Care Act, and he has no plan to replace it.",0.6205,0.49060000000000004,0.5822999999999999
S007,36,4,"He has “concepts of a plan,” concepts.",0.6586666666666666,0.39799999999999996,0.6526666666666667
S007,37,0,So here’s the thing though.,0.449,0.222,0.26
S007,37,1,"We can laugh about many things, but the consequences of this are quite serious, quite serious.",0.5815714285714285,0.44571428571428573,0.5419999999999999
S007,37,2,Because think about it.,0.786,0.408,0.618
S007,37,3,He’s going to threaten health coverage and health insurance for 45 million people in our country based on a concept and take us back to when insurance companies could deny people with pre-existing conditions?,0.6448888888888888,0.4505000000000001,0.583388888888889
S007,37,4,You remember what that was like?,0.7216666666666667,0.3383333333333333,0.48466666666666663
S007,37,5,"Well, we are not going back.",0.5393333333333333,0.3446666666666667,0.4446666666666667
S007,37,6,We are not going back.,0.5393333333333333,0.3446666666666667,0.4446666666666667
S007,37,7,We’re not going back.,0.474,0.397,0.39
S007,37,8,We’re not going back.,0.474,0.397,0.39
S007,37,9,"We will move forward, and we’ll take on the biggest issues facing our nation.",0.671375,0.5325,0.629625
S007,37,10,We have talked about the economy.,0.7243333333333334,0.38966666666666666,0.6526666666666666
S007,37,11,"We have talked about what we can do in terms of investing in the ambition, the aspirations of our country.",0.6637777777777778,0.51,0.6147777777777778
S007,37,12,We will take on the issue of immigration.,0.5579999999999999,0.60775,0.472
S007,37,13,We will take on a number of issues on the subject of immigration.,0.5399999999999999,0.501,0.4861666666666667
S007,37,14,"We must have comprehensive immigration reform with strong border of security and an earned pathway to citizenship, including for hardworking immigrants who have been here for years, including our dreamers, including our dreamers.",0.6776190476190476,0.45285714285714285,0.5975238095238096
S007,37,15,And I was Attorney General of a border state.,0.6144000000000001,0.404,0.6378
S007,38,0,"I prosecuted transnational criminal organizations who traffic in guns, drugs, and human beings.",0.38771428571428573,0.6421428571428571,0.6218571428571428
S007,38,1,"And as president, I will double the resources for the Department of Justice to go after those transnational cartels and take action to stop the flow of fentanyl coming into our country, which is destroying entire communities.",0.6187222222222223,0.4688333333333332,0.6248333333333334
S007,38,2,"These are serious problems, and we know Donald Trump won’t solve them.",0.5701428571428572,0.47914285714285715,0.6589999999999999
S007,38,3,"When he was president, he did nothing to fix our immigration system.",0.6303333333333333,0.49350000000000005,0.6333333333333334
S007,38,4,"And earlier this year, we had a chance to pass the toughest bipartisan board of security bill in decades, and Donald Trump tanked the bill because he thought that that bill, if passed, would’ve hurt him and he’d prefer to run on a problem instead of fixing a problem.",0.5129565217391303,0.4653478260869566,0.5244782608695652
S007,38,5,That’s not the kind of president we want.,0.7553333333333333,0.5013333333333333,0.7296666666666667
S007,38,6,"As president, he cruelly separated families and plans to do it again.",0.5578333333333333,0.5661666666666667,0.6175
S007,38,7,And he continues to fan the flames of fear and division.,0.46040000000000003,0.5502,0.46980000000000005
S007,38,8,"Look, we need a president who cares more about solving problems than playing political games and demeaning people full-time.",0.5292727272727273,0.5421818181818181,0.5578181818181819
S007,38,9,I’m tired of that.,0.125,0.317,0.191
S007,38,10,We’re done with that.,0.67,0.548,0.536
S007,38,11,"So Nevada, ours is a fight for the future, and it is a fight for freedom, like the fundamental freedom of a woman to be able to make decisions about her own body and not have her government tell her what to do.",0.6966666666666667,0.48172222222222216,0.6867222222222222
S007,38,12,And we remember how we got here.,0.758,0.508,0.5605
S007,38,13,"Donald Trump hand-selected three members of the United States Supreme Court, the court of Thurgood and RBG, so that they would do as they did and overturn the protections of Roe V.",0.6048000000000001,0.5174666666666666,0.6157333333333332
S007,38,14,Wade.,0.51,0.656,0.472
S007,38,15,"And now, one in three women in America lives in a state with a Trump abortion ban, many with no exceptions, even for rape and incest.",0.4147,0.5936,0.5505
S007,38,16,"It is immoral, immoral.",0.3186666666666667,0.49466666666666664,0.44133333333333336
S007,38,17,And let us agree one does not have to abandon their faith or deeply held beliefs to agree the government shouldn’t be telling her what to do.,0.6373571428571427,0.3775,0.5279285714285714
S007,38,18,"If she chooses, she will talk with her priest, her pastor, her rabbi, her imam, but not the government telling her what to do with",0.6207,0.4074,0.6546
S007,39,0,"… price gouging that we know has resulted in jacking prices up, often around tragedies and emergencies.",0.4972222222222223,0.5434444444444444,0.5414444444444445
S007,39,1,"We will give a tax cut to a hundred million more Americans, including $6,000 during the first year of a child’s life, knowing that the vast majority of our young parents have a natural desire to parent their children well, but not always the resources to do it.",0.7079090909090908,0.4442727272727273,0.6140909090909091
S007,39,2,"And that $6,000 in extending and expanding the child tax credit will help buying a crib, buying a car seat, doing the things that are so critical in that first phase of life.",0.6481052631578947,0.4937894736842105,0.5674210526315789
S007,39,3,"I will also make sure good paying jobs are available to all Americans, not only those with college degrees, because we need to recognize the value of additional paths, such as apprenticeships and technical programs.",0.6933888888888888,0.41644444444444445,0.6154444444444445
S007,40,0,"Look, generations before us, generations of America led the fight for freedom, and the baton, well, it’s now in our hands.",0.64525,0.500875,0.638375
S007,40,1,It’s now in our hands.,0.542,0.314,0.434
S007,40,2,"And it all comes down to this, we are here together.",0.57025,0.30774999999999997,0.5085000000000001
S007,40,3,You came out on a Sunday evening.,0.5876666666666667,0.21666666666666667,0.42333333333333334
S007,40,4,We are here together because we know what is at stake and we are here together because we love our country.,0.7363333333333334,0.37622222222222224,0.6119999999999999
S007,40,5,We love our country.,0.849,0.4565,0.683
S007,40,6,We love our country.,0.849,0.4565,0.683
S007,41,0,"And remember, your vote is your voice.",0.6555,0.37625,0.54625
S007,41,1,Your voice is your power.,0.661,0.4176666666666667,0.6783333333333333
S007,41,2,Don’t ever let anybody take your power from you.,0.6609999999999999,0.532,0.5359999999999999
S007,41,3,Never.,,,
S007,41,4,Never.,,,
S007,41,5,Don’t let anybody silence you ever.,0.5116666666666666,0.37366666666666665,0.35533333333333333
