speech_id,line_id,sentence_id,sentence_text,valence,arousal,dominance
S022,19,9,"We will move forward because ours is a fight for the future and it is a fight for freedom, like the fundamental freedom of a woman to make decisions about her own body and not have her government tell her what to do.",0.7005789473684211,0.4946315789473684,0.6922105263157895
S022,20,0,And we know how we got to this issue because Donald Trump handpicked three members of the United States Supreme Court with the intention that they would undo the protections of Roe v.,0.6125333333333334,0.5010666666666667,0.6142666666666666
S022,20,1,Wade.,0.51,0.656,0.472
S022,20,2,And they did as he intended.,0.538,0.545,0.5615
S022,20,3,"And now in over 20 states in our nation, they have what I call Trump abortion bans, including North Carolina and every single state in the south except Virginia.",0.50175,0.46049999999999996,0.5503333333333335
S022,20,4,Think about that.,0.786,0.408,0.618
S022,20,5,Every single state in the south except Virginia.,0.4716666666666667,0.313,0.4306666666666667
S022,20,6,"Now one in three women in America lives under Trump abortion ban, many with no exceptions, even for rape and incest.",0.3983333333333333,0.624,0.5445555555555556
S022,20,7,It is immoral.,0.40650000000000003,0.431,0.46950000000000003
S022,20,8,It is immoral.,0.40650000000000003,0.431,0.46950000000000003
S022,20,9,And I know we all here understand and agree one does not have to abandon their faith or deeply held beliefs to agree the government should not be telling her what to do with her body.,0.6696875,0.38175000000000003,0.5626249999999999
S022,21,0,And what we know is that the impact of this… It’s been over two years now since that decision came down.,0.57,0.3737777777777778,0.5734444444444445
S022,21,1,The impact of this is so real.,0.6193333333333334,0.5446666666666667,0.6823333333333333
S022,21,2,"It’s affecting people every day just based on the stories we know, and there are so many stories we don’t know.",0.6483999999999999,0.3863,0.5742
S022,21,3,Think about it.,0.786,0.408,0.618
S022,21,4,"Because of Trump’s abortion bans, women are being refused care during miscarriages.",0.39275000000000004,0.5351250000000001,0.48450000000000004
S022,21,5,Some are only being treated if they develop sepsis.,0.5826,0.4346,0.5384
S022,21,6,"And when asked on Tuesday night, Donald Trump refused to say that he would veto a national abortion ban.",0.4238181818181817,0.4744545454545454,0.4754545454545455
S022,21,7,You remember that?,0.776,0.422,0.454
S022,21,8,He refused to answer that question.,0.4033333333333333,0.41933333333333334,0.4526666666666667
S022,21,9,Refused to answer that question.,0.4033333333333333,0.41933333333333334,0.4526666666666667
S022,21,10,"Well, I’m going to tell you.",0.5305,0.39549999999999996,0.4505
S022,21,11,"When Congress passes a bill to restore reproductive freedom, as President of the United States, I will proudly, proudly, sign it into law.",0.6614166666666667,0.4716666666666667,0.7039166666666667
S022,21,12,Proudly.,,,
S022,22,0,"And across our nation, across our nation, we are witnessing a full-on assault on other hard fought, hard won fundamental freedoms and rights like the freedom to vote, the freedom to be safe from gun violence, the freedom to breathe clean air and drink clean water and the freedom to love who you love openly and with pride.",0.6788823529411765,0.48126470588235293,0.6707058823529412
S022,22,1,And North Carolina has a history of the point I’m about to make.,0.6382,0.3278,0.5416
S022,22,2,"Generations, generations of Americans before us led the fight for freedom.",0.7258,0.6058,0.7078000000000001
S022,22,3,And now the baton is in our hands.,0.49466666666666664,0.26299999999999996,0.5023333333333333
S022,22,4,It is in our hands.,0.6060000000000001,0.277,0.494
S022,22,5,So we who believe in the sacred freedom to vote will finally pass the John Lewis Voting Rights Act and the freedom to vote at it.,0.6984615384615385,0.4644615384615385,0.6733846153846155
S022,22,6,"And we who believe in the freedom to live safe from gun violence will finally pass an assault weapons ban, universal background checks.",0.5078666666666666,0.5742666666666666,0.6611333333333334
S022,22,7,And red flag laws.,0.5863333333333333,0.451,0.576
S022,23,0,"So much, so much is at stake in this election.",0.5670000000000001,0.45566666666666666,0.555
S022,23,1,So much is at stake in this election.,0.5670000000000001,0.45566666666666666,0.555
S022,23,2,"And understand this is not 2016 or 2020 for a number of reasons, including why the stakes are higher.",0.632625,0.382375,0.5605
S022,23,3,"Because two months ago, the United States Supreme Court Supreme basically told the former president that he will effectively be immune no matter what he does in the White House.",0.6212500000000001,0.42393749999999997,0.6569375
S022,23,4,Think about that.,0.786,0.408,0.618
S022,23,5,Think about that.,0.786,0.408,0.618
S022,23,6,Just imagine Donald Trump with no guardrails.,0.6995,0.598,0.7424999999999999
S022,23,7,Right?,0.74,0.352,0.71
S022,23,8,"He who has vowed that if re-elected he’ll be a dictator on day one, that he will weaponize the Department of Justice against his political enemies, and has called for the quote, “termination of the Constitution of the United States of America.” Think about that.",0.5954999999999999,0.46627777777777774,0.6409444444444445
S022,23,9,And let us be very clear.,0.6513333333333333,0.3133333333333333,0.478
S022,23,10,Somebody who suggests we should terminate the Constitution of the United States should never again stand behind the seal of the President of the United States.,0.5787,0.3927,0.6621
S022,23,11,Never again.,,,
S022,23,12,Never again.,,,
S022,23,13,Never again.,,,
S022,24,0,"And one of the points that I mentioned on Tuesday, the people who served under him at the White House, who saw him every day, his national security advisor, his defense secretary, his chief of staff, and his vice president, all have warned, all who worked with him every day in the White House, sat with him in the Oval Office, have warned America, Donald Trump is not fit to be President of the United States and should never again occupy our nation’s highest office.",0.5880512820512821,0.40815384615384614,0.5971282051282051
S022,24,1,And we’re not going back.,0.474,0.397,0.39
S022,25,0,But here’s also the thing.,0.449,0.222,0.26
S022,25,1,Ours will be a very tight race until the end.,0.5395,0.35574999999999996,0.56125
S022,25,2,Okay?,,,
S022,25,3,It’s going to be a tight race until the end.,0.49250000000000005,0.364,0.48850000000000005
S022,25,4,And we are the underdog.,0.46,0.32499999999999996,0.39
S022,25,5,Understand that.,0.76,0.374,0.643
S022,25,6,We are the underdog.,0.46,0.32499999999999996,0.39
S022,25,7,There are powerful forces trying to convince people that their vote doesn’t matter.,0.637888888888889,0.5163333333333333,0.6663333333333334
S022,25,8,There are powerful forces here too.,0.6953333333333335,0.5853333333333333,0.8103333333333333
S022,25,9,But I say all that to say we’ve got some hard work ahead of us.,0.6018333333333333,0.5063333333333333,0.6116666666666667
S022,25,10,But here’s the thing I love about everybody here.,0.7245,0.3705,0.4665
S022,25,11,We love hard work.,0.6736666666666666,0.6076666666666667,0.6796666666666668
S022,25,12,Hard work is good work.,0.6695999999999999,0.5016,0.6408
S022,25,13,Hard work is good work.,0.6695999999999999,0.5016,0.6408
S022,25,14,Hard work is good work.,0.6695999999999999,0.5016,0.6408
S022,25,15,"And with your help, we will win in November.",0.766,0.5243333333333333,0.6943333333333334
S022,25,16,We will win.,0.8125,0.5509999999999999,0.8115
S022,25,17,We will.,0.698,0.408,0.735
S022,25,18,We will win.,0.8125,0.5509999999999999,0.8115
S022,25,19,"So North Carolina, today I then ask you, are you ready to make your voices heard?",0.66825,0.35262499999999997,0.49062500000000003
S022,25,20,Do we believe in freedom?,0.8066666666666666,0.4873333333333334,0.7076666666666668
S022,25,21,Do we believe in opportunity?,0.7963333333333334,0.5543333333333333,0.6836666666666668
S022,25,22,Do we believe in the promise of America?,0.758,0.47266666666666673,0.6406666666666666
S022,25,23,And are we ready to fight for it?,0.657,0.49866666666666665,0.6703333333333333
S022,25,24,"And when we fight, we win.",0.7290000000000001,0.7809999999999999,0.8485
