line_id,line_text,speech_id
34,"Because at the same time that Donald Trump was giving a tax cut to big corporations and billionaires, he tried to slash programs for small businesses and raise borrowing costs for them. Instead of making it easier, he actually made it more difficult for them to access capital. And that’s not surprising because Donald Trump just does not prioritize small businesses. He does not seem to value, frankly, the essential role they play. But, look, when I look at small business owners, I see some of the heroes of our economy. Not only entrepreneurs, but as I said, civic leaders, community leaders, part of the glue that holds communities together. The third pillar of our opportunity economy is leading the world in the industries of the future and making sure America, not China, wins the competition for the 21st century.",S013
35,"One of the recurring themes in American history is that when we make an intentional effort to invest in our industrial strength, it leads to extraordinary prosperity and security, not only for years, but for generations. Think of Alexander Hamilton, having the foresight to build the manufacturing capabilities of our new nation. Think of Lincoln and the transcontinental railroad. Think of Eisenhower and the interstate highway system. Kennedy committing America to win the space race, and spurring innovation across our society.",S013
36,"From our earliest days, America’s economic strength has been tied to our industrial strength. And the same is true today. So I will recommit the nation to global leadership in the sectors that will define the next century. We will invest in biomanufacturing and aerospace, remain dominant in AI and quantum computing, blockchain, and other emerging technologies, expand our lead in clean energy innovation and manufacturing, so the next generation of breakthroughs, from advanced batteries to geothermal, to advanced nuclear are not just invented, but built here in America by American workers.",S013
37,"And we will invest in the industries that, for example, made Pittsburgh the steel city by offering tax credits for expanding good union jobs in steel and iron and manufacturing communities like here in Mon Valley. And across all these industries of the future, we will prioritize investments for strengthening factory towns. This is so important. For strengthening factory towns, retooling existing factories, hiring locally, and working with unions. Because no one who grows up in America’s greatest industrial or agricultural centers should be abandoned. And understand what that means for real people, people we know, people we care about. We don’t have to abandon a strength we’ve known to achieve a strength that we plan. And",S013
38,"And they create nearly 50% of private sector jobs and they strengthen our middle class. And if we can harness the entrepreneurialism of the American people and unlock the full potential of aspiring founders and small business owners, I am optimistic that no one will be able to outpace us.",S013
39,"And so one of the things we must do, understanding that and understanding the nature of that part of our educational system is let’s eliminate degree requirements while increasing skills development. And let’s start with something I can do as president was ensure that we do that for the half million of federal jobs that are within our ability to make it so, showing what is possible and then challenging the private sector to make a similar commitment to emphasizing skills and not just degrees.",S013
40,"And we will reform our tax laws to make it easier for businesses to let workers share in their company’s success. And I will challenge the private sector to do more, to lift up workers through equity, profits, and benefits so more people can share in America’s success and prosperity.",S013
41,"And not only must we build the industries of the future in America, we must also build them faster. There’s a time for patience and there’s a time for impatience. That’s not in ecclesiastics, but … Just swapped script for a minute, mayor. But the simple truth is, in America, it takes too long and it costs too much to build. Whether it’s a new housing development, a new factory, or a new bridge, projects take too long to go from concept to reality. It happens in blue states, it happens in red states, and it’s a national problem.",S013
42,"And I will tell you this, China is not moving slowly. They’re not. And we can’t afford to, either. If we are to compete, we can’t afford to, either. As president, if things are not moving quickly, I will demand to know why and I will act. I will work with Congress, workers and businesses, cities and states, community groups and local leaders to reform permitting, to cut red tape and get things moving faster because, look, as I said, patience may be a virtue, but not when it comes to job creation or America’s competitiveness. Many of you know, the Empire State Building, you know how long it took to build that? One year. The Pentagon, you know how long that took? 16 months. No one can tell me we can’t build quickly in our country. I’ve got empirical evidence.",S013
43,"Now look, my opponent, Donald Trump. Well, he makes big promises on manufacturing. Just yesterday he went out and promised to bring back manufacturing jobs. And if that sounds familiar, it should. In 2016, he went out and made that very same promise about the Carrier plant in Indianapolis. You’ll remember Carrier then offshored hundreds of jobs to Mexico under his watch. And it wasn’t just there. On Trump’s watch, offshoring went up and manufacturing jobs went down across our country and across our economy. All told, almost 200,000 manufacturing jobs were lost during his presidency starting before the pandemic hit, making Trump one of the biggest losers ever on manufacturing.",S013
44,"Donald Trump also talked a big game on our trade deficit with China, but it is far lower under our watch than any year of his administration. While he constantly got played by China, I will never hesitate to take swift and strong measures when China undermines the rules of the road at the expense of our workers, our communities, and our companies, whether it’s flooding the market with steel, inferior or at all, unfairly subsidizing shipbuilding, or hurting our small businesses with counterfeits. Recall, Donald Trump actually shipped advanced semiconductor chips to China, which helps them upgrade their military. Understand the impact of these so-called policies that really are not about a plan for strengthening our prosperity or our security. I will never sell out America to our competitors or adversaries. Never, never and I will always make sure we have the strongest economy and the most lethal fighting force anywhere in the world.",S013
45,"So at this pivotal moment, we have an extraordinary opportunity to chart a new way forward, one that positions the United States of America and all of us were blessed to call this home for success and prosperity in the 21st century.",S013
46,"There’s an old saying that the best way to predict the future is to invent it. Well, that is the story of the Steel City. That is the story of the Steel City, the city that helped build the middle class, birth America’s labor movement, empower the rise of American manufacturing. And the city where Alan Newell and Herbert Simon launched the first AI research hub at Carnegie Mellon and created entirely new fields like machine learning. And Carnegie Mellon is now home to the largest university robotics center in America. So the proud heritage of Pittsburgh, I so strongly believe reveals the character of our nation, a nation that harnesses the ambitions, the dreams, and the aspirations of our people, seizes the opportunities before us because we see them, because we believe in them, and then invents the future. That is what we have always done, and that is what we must now do, and I know we will. I thank you all for inviting me. May God bless you and may God bless the United States of America. Thank you all.",S013
47,"And here’s what else we will do when I am president, we will double the number of registered apprenticeships by the end of my first term because I almost made it a goal of mine. I think I am going to fall short, but trying to visit every IBEW local in America, because I’m going to tell you, those apprenticeship programs, those are tough duty, man and women and everyone. They’re tough duty. I mean, talk about the skills that are about engineering and science and math and just the most highly skilled folks who are in those apprenticeships and teaching there.",S013
