speech_id,line_id,sentence_id,sentence_text,valence,arousal,dominance
S023,32,0,"Here with us today, I know we have a number of native leaders.",0.6407499999999999,0.35075,0.6194999999999999
S023,32,1,"And as president, I will tell you, I will always honor tribal sovereignty and respect tribal self-determination.",0.665375,0.42925,0.6739999999999999
S023,32,2,And fight for a future where every native person can realize their aspirations and every native community is a place of opportunity.,0.6752222222222222,0.4613333333333334,0.641
S023,32,3,"We here, we believe in a future where we lower the cost of living for America’s families so that they have the chance not just to get by, but to get ahead.",0.6995555555555555,0.49622222222222223,0.5937777777777777
S023,33,0,"Because, look, while our economy is doing well by many measures, prices for everyday things like groceries are still too high.",0.6602,0.3584,0.49479999999999996
S023,33,1,You know it and I know it.,0.765,0.361,0.704
S023,33,2,"When I was attorney general, I went after price fixing schemes.",0.5395,0.5345,0.6445000000000001
S023,33,3,"And when I am president, I will continue that work to bring down prices.",0.578,0.44420000000000004,0.5646000000000001
S023,33,4,I will take on big corporations that engage in illegal price gouging.,0.6064999999999999,0.5984999999999999,0.5800000000000001
S023,33,5,I will take on corporate landlords that unfairly raise rents on working families.,0.7486,0.5338,0.6338
S023,34,0,I will take on big pharma and cap the cost of prescription drugs for all Americans.,0.539142857142857,0.4685714285714286,0.5207142857142857
S023,34,1,"And all of this is to say, unlike Donald Trump, I will always put the middle class and working families first.",0.5851666666666667,0.3835,0.5101666666666668
S023,34,2,Because you see Coach Walz and I know the middle class built the United States of America.,0.6546666666666667,0.3925,0.5593333333333332
S023,34,3,"And when the middle class is strong, America is strong.",0.557,0.2355,0.41100000000000003
S023,34,4,"And while we work to move our nation forward, look, Donald Trump be very clear, intends to move us backward.",0.6558333333333334,0.5481666666666668,0.7271666666666666
S023,34,5,Just look.,,,
S023,34,6,And we’re not going back.,,,
S023,35,0,"And, Arizona, every day you feel the impact of extreme heat and drought.",0.5683999999999999,0.6334,0.583
S023,35,1,You know his crisis is real.,0.4865,0.5860000000000001,0.5675
S023,35,2,He calls it a hoax.,0.608,0.431,0.551
S023,35,3,"And on top of all of this, if Donald Trump wins in November, he intends to end the Affordable Care Act.",0.6334,0.4466,0.5486
S023,35,4,And take us back to a time when insurance companies have the power to deny people with pre-existing conditions.,0.6225,0.4515,0.5606249999999999
S023,35,5,You remember what that was?,0.776,0.422,0.454
S023,35,6,Remember what that was?,0.776,0.422,0.454
S023,36,0,We will win.,0.698,0.408,0.735
S023,36,1,We will win.,0.698,0.408,0.735
S023,37,0,He won’t win.,,,
S023,37,1,You’re right.,,,
S023,38,0,We will win.,0.698,0.408,0.735
S023,38,1,We will win.,0.698,0.408,0.735
S023,39,0,We will win.,0.698,0.408,0.735
S023,39,1,We will win.,0.698,0.408,0.735
S023,39,2,We will win.,0.698,0.408,0.735
S023,40,0,I know what I’m talking about.,0.765,0.361,0.704
S023,40,1,"We know our immigration system is broken, and we know what it takes to fix it: comprehensive reform that includes strong border security and an earned pathway to citizenship.",0.6748181818181819,0.4586363636363636,0.6586363636363637
S023,40,2,Donald Trump does not want to fix this problem.,0.6903333333333332,0.632,0.6716666666666667
S023,40,3,Be clear about that.,0.7635000000000001,0.2835,0.5635
S023,40,4,He has no interest or desire to actually fix the problem.,0.8119999999999999,0.6323333333333333,0.5946666666666668
S023,40,5,"He talks a big game about border security, but he does not walk the walk.",0.6465000000000001,0.5425,0.5447500000000001
S023,40,6,"Everybody here knows, earlier this year we had a chance to pass the toughest bipartisan border security bill in decades, but Donald Trump tanked the deal because he thought by doing that, it would help him win an election.",0.639846153846154,0.4509230769230769,0.5544615384615385
S023,40,7,"When I am president, I will sign the bill.",0.659,0.4445,0.5660000000000001
S023,41,0,"Arizona, ours is a fight for the future, and it is a fight for freedom.",0.531,0.868,0.809
S023,41,1,"Across our nation, we are witnessing a full-on assault against hard fought, hard-won freedoms and rights, the freedom to vote, the freedom to be safe from gun violence, the freedom to love who you love openly and with pride, and the freedom of a woman to make decisions about her own body and not have her government telling her what to do.",0.7025882352941177,0.5214705882352941,0.6901176470588236
S023,41,2,"On that last point, understand how we got here.",0.76,0.374,0.643
S023,42,0,"When he was President, Donald Trump hand-picked three members of the United States Supreme Court with the intention that they would overturn and undo the protections of Roe V.",0.5484,0.5324,0.6064999999999999
S023,42,1,Wade.,,,
S023,42,2,"And as he intended, they did.",,,
S023,42,3,"And now, in over 20 states in our nation, there is a Trump abortion ban, many like Arizona, with no exceptions even for rape or incest.",0.37575,0.67375,0.5385
S023,42,4,"Just yesterday, in a press conference, we got a fresh reminder of what Donald Trump’s Project 2025 agenda would do.",0.6268333333333334,0.4008333333333334,0.5553333333333333
S023,42,5,It would ban medication abortion in every state.,0.334,0.5775,0.44925
S023,42,6,"But we are not going to let that happen, because we trust women.",0.6575,0.46,0.524
S023,42,7,"When I am President of the United States, and when Congress passes a bill to restore reproductive freedoms for every woman in America, I will sign it into law.",0.6445000000000001,0.48524999999999996,0.7201249999999999
S023,43,0,"Listen, here’s the thing that we all know.",0.449,0.222,0.26
S023,43,1,Here’s the thing we all know.,0.449,0.222,0.26
S023,43,2,Generations of Americans before us led the fight for freedom.,0.531,0.868,0.809
S023,43,3,"Now, the baton is in our hands, each and every one of us.",0.40700000000000003,0.26349999999999996,0.4445
S023,43,4,We who believe in the sacred freedom to vote will finally pass the John Lewis Voting Rights Act and the Freedom to Vote Act.,0.695,0.47383333333333333,0.6703333333333333
S023,43,5,"We who believe in the freedom to live safe from gun violence will finally pass an assault weapons ban, universal background checks and red flag laws.",0.5652857142857142,0.5211428571428571,0.6292857142857143
S023,43,6,"So much is on the line in this election, and understand, this is not 2016, and this is not 2020.",0.541,0.18,0.353
S023,43,7,"This time around, the stakes are even higher, and that’s because last month, the United States Supreme Court basically just told the former president who has been convicted of fraud that going forward, he will be effectively immune no matter what he does in the White House.",0.5948,0.4971,0.7204
S023,44,0,Think about what that means.,0.786,0.408,0.618
S023,44,1,Think about what that means in this election.,0.7005,0.39049999999999996,0.539
S023,44,2,Think about what that means.,0.786,0.408,0.618
S023,44,3,He’s been effectively told he will be immune if he’s back in the White House.,0.60875,0.36824999999999997,0.60125
S023,44,4,"Think about what that means when you remember Donald Trump has openly vowed if re-elected, he will be a dictator on day one, that he will weaponize the Department of Justice against his political enemies.",0.6225384615384615,0.462923076923077,0.6586153846153847
S023,44,5,"Remember that he even called for the “Termination of the Constitution of the United States.” Understand what this means, and let us be very clear.",0.6673333333333334,0.37000000000000005,0.605
S023,44,6,Someone who suggests we should terminate the Constitution of the United States should never again stand behind the seal of the United States President.,0.5688333333333333,0.36566666666666664,0.6538333333333333
S023,44,7,Never again.,,,
S023,44,8,Never again.,,,
S023,44,9,"Arizona, it all comes down to this.",0.208,0.33,0.264
S023,44,10,We are here because we love our country.,1.0,0.519,0.673
S023,44,11,We love our country.,1.0,0.519,0.673
S023,45,0,"And part of why we are going to win is because we remember, and we are smart, and we know what’s happening, and we’re not falling for the gaslighting, and we’re not falling for the Okie doke.",0.5518,0.5529999999999999,0.5128
S023,45,1,That’s why.,,,
S023,45,2,"Look, America has tried so many of those failed policies before, and like we all know, we’re not going back.",0.719,0.353,0.446
S023,45,3,We will move forward and take on the biggest issues facing our nation.,0.7318,0.48200000000000004,0.6106
S023,45,4,"For example, the issue of immigration.",0.316,0.819,0.351
S023,45,5,I was attorney general of a border state.,0.6133333333333333,0.48666666666666664,0.677
S023,45,6,"I went after the transnational gangs, the drug cartels and human traffickers.",0.4905,0.552,0.529
S023,45,7,"I prosecuted them in case after case, and I won.",0.427,0.275,0.441
S023,46,0,"USA, USA, USA.",,,
S023,47,0,"We together, all of us, we’re running this campaign on behalf of all Americans, from red states to blue states, from the heartland to the coast.",0.6434,0.524,0.5216
S023,47,1,"When we are elected, we will govern on behalf of all Americans, all Americans.",0.6355,0.5549999999999999,0.8574999999999999
S023,47,2,"Arizona, ultimately in this election, I do believe we each, each one of us, we face a question.",0.5898,0.37260000000000004,0.5198
S023,47,3,"That question being, what kind of country do we want to live in?",0.7244999999999999,0.4845,0.605
S023,47,4,"Do we want to live in a country of chaos, fear and hate, or a country of freedom, compassion and rule of law?",0.624,0.522,0.573875
S023,47,5,The beauty of our democracy is that we each have the power to answer that question.,0.707,0.5064,0.7382
S023,47,6,Each one of us in a democracy has the power to answer that question.,0.6194999999999999,0.45875000000000005,0.706
S023,47,7,"The power is with the people, and in the next 88 days, we need you to use your power.",0.5556666666666666,0.5339999999999999,0.5206666666666667
S023,47,8,We need you to knock on some doors.,0.41100000000000003,0.5525,0.36350000000000005
S023,47,9,We need you to register folks to vote.,0.5,0.493,0.42700000000000005
S023,47,10,"We need you to energize, to mobilize, to organize, and to make your voices heard.",0.597,0.497,0.33999999999999997
S023,47,11,"Arizona, I ask, are you ready to make your voices heard?",0.7270000000000001,0.404,0.5640000000000001
S023,47,12,Do we believe in freedom?,0.7255,0.459,0.609
S023,47,13,Do we believe in opportunity?,0.7255,0.459,0.609
S023,47,14,Do we believe in the promise of America?,0.758,0.47266666666666673,0.6406666666666666
S023,47,15,Are we ready to fight for it?,0.6505000000000001,0.628,0.7285
S023,47,16,"When we fight, we win.",,,
S023,47,17,"God bless you, and God bless the United States of America.",0.8310000000000001,0.4010000000000001,0.7462
