speech_id,line_id,line_text,valence,arousal,dominance
S030,96,"Remember how he’s talked about striking workers, that you should fire them. That’s how he talks about union labor. That’s how he talks about workers.",0.6898000000000001,0.5151999999999999,0.6416000000000001
S030,97,"But, Flint, we know strong unions mean higher wages, better health care, and greater dignity for union members and for everyone.",0.7653076923076922,0.42092307692307696,0.6842307692307692
S030,98,"And on top of all of that, Donald Trump signed a $2 trillion tax cut that mostly went to the wealthy and big corporations, not to working people.",0.6145000000000002,0.4916666666666667,0.6221666666666666
S030,99,And now he is making the same empty promises to the people in Michigan that he did before. But we will not be fooled. We will not be gaslighted. Donald Trump’s track record is a disaster for working people.,0.5645555555555556,0.4425555555555556,0.5367222222222223
S030,100,"And if he wins again, it will be more of the same. Check this out. Two days ago, his running mate, maybe you saw that. No, but … How about that Tim Walz, by the way? That’s right. That’s right.",0.6328461538461537,0.4183076923076924,0.5726923076923076
S030,101,"So, two days ago, Donald Trump’s running mate suggested that if Trump wins, he might let the Grand River assembly plant in Lansing close down, the same plant that our administration helped save earlier this year, along with 650 union jobs.",0.6376666666666666,0.42887499999999995,0.557625
S030,102,"Michigan, we together fought hard for those jobs. And you deserve a president who won’t put them at risk.",0.5931111111111111,0.5765555555555556,0.6743333333333333
S030,103,"And for anybody watching, you know, if you want to learn more about Donald Trump’s plans, just google Project 2025.",0.6872857142857143,0.53,0.7197142857142858
S030,104,"It is a detailed and dangerous blueprint for what he will do if he is elected president. Donald Trump will give billionaires and corporations massive tax cuts, attack unions, cut Social Security and Medicare, and impose a Trump sales tax, a 20% tax on everyday basic necessities, which will cost the average family nearly $4,000 a year.",0.5871428571428573,0.4695428571428571,0.6211142857142856
S030,105,"And on top of all this, Donald Trump intends to end the Affordable Care Act even after he tried to repeal it time and time again when he was president and still has no plan to replace it.",0.6015,0.4609375,0.6003750000000001
S030,106,"Now, you know, I have said that I do believe he is an unserious man. And the consequences of him being president again are absolutely, critically serious. ‘Cause, think about it. Even on health care, he has a concept of a plan. So, he’s going to threaten the health insurance of 45 million people in our country based on a concept?",0.6517692307692309,0.4243461538461538,0.6181153846153846
S030,107,"To take us back, do you remember that, when insurance companies could deny people with preexisting conditions? Remember what that was like?",0.664,0.4263333333333333,0.51375
S030,108,"Well, Michigan, we are not …",0.67,0.24,0.554
S030,109,"And these 32 days out from the election, it’s important that we remind people how we got here. Donald Trump handpicked three members of the United States Supreme Court with the intention that they would overturn Roe v. Wade, and they did. And now more than one in three women in America lives in a state with a Trump abortion ban, many with no exceptions even for rape and incest, which is immoral.",0.540483870967742,0.5278064516129032,0.5784838709677419
S030,110,"And when Congress passes a bill to restore reproductive freedom, as President of the United States, I will proudly sign it into law. Proudly.",0.6614166666666667,0.4716666666666667,0.7039166666666667
S030,111,"And here’s what I want to say. Look, and that’s not our only battle. Across our nation, we are witnessing a full-on assault on other hard-fought, hard-won freedoms and rights, like the freedom to vote; the freedom to be safe from gun violence; the freedom to join a union; the freedom to love who you love openly and with pride; and the freedom to breathe clean air and drink clean water.",0.6810810810810809,0.47327027027027035,0.6567837837837839
S030,112,"Flint, you know all too well, Flint, that clean water should be a right for everyone, not just for the people who can afford it. And as president, I will continue to work with communities like Flint to ensure you not only have clean water but the opportunity to recover economically and thrive.",0.7226666666666667,0.39712499999999995,0.6142500000000001
S030,113,"So, Michigan, it all comes down to this. We are all here together because we know what is at stake, and we love our country. We love our country. We love our country.",0.708923076923077,0.3983846153846154,0.6038461538461538
S030,114,"So, Election Day is in 32 days. And already nearly 2 million ballots are in the hands of Michigan voters alone.",0.6187,0.3564,0.5111
S030,115,"So, if you have received your ballot, please do not wait. Fill it out and return it today. Early voting starts statewide on October 26th, and now is the time to make your plan to vote, because, folks, the election is here. The election is here. And we need to energize, organize, and mobilize. And remember: Your vote is your voice, and your voice is your power. So, Flint, today I ask: Are you ready to make your voices heard?",0.649375,0.42245,0.5559499999999999
S030,116,Do we believe in freedom?,0.8066666666666666,0.4873333333333334,0.7076666666666668
S030,117,God bless you. And God bless the United States of America.,0.7861666666666668,0.3875,0.7225
